1,Fixed windows,Glazing (Windows),Glass,Glass panels (Pr_25_71_33_35),Glazing systems (Ss_25_60_35),,,1,,1,1,piece,NorDan NTech Fixed frame - FA 105 (without aluminium cladding),NorDan AS,https://app.2050-materials.com/product/details_designer/nordan-as-nordan-ntech-fixed-frame-fa-105-without-aluminium-cladding,79.1,kg CO₂/piece,,0.9946899303872351,"Glazing (Windows), Glass (per kg)",2050 Materials Research (September 2023),3.067016,kg CO₂/kg,630,0.9972627090316215
2,Motorized openable windows,Glazing (Windows),Aluminium,"Glass and glazing sheets and profiles (Pr_25_71_33),Glass panels (Pr_25_71_33_35)",Glazing systems (Ss_25_60_35),,,1,,1,1,piece,NorDan NTech Villa Topswing reversible - TG 105/80 (without Aluminium Cladding),NorDan AS,https://app.2050-materials.com/product/details_designer/nordan-as-nordan-ntech-villa-topswing-reversible-tg-105-80-without-aluminium-cladding,92.8,kg CO₂/piece,,0.9942275484713303,"Glazing (Windows), Glass (per m2)",2050 Materials Research (September 2023),112.7096,kg CO₂/m2,631,0.9957575888446917
3,Door (Porte alluminio - vetro),External doors,Aluminium,Doorsets (Pr_30_59_24),Door and window systems (Ss_25_30),,,1,,1,1,piece,Schüco ADS 70-HI Door system with triple glazing,AluKönigStahl GmbH,https://app.2050-materials.com/product/details_designer/alukonigstahl-gmbh-schuco-ads-70-hi-door-system-with-triple-glazing,442,kg CO₂/piece,,0.9947742172684931,External door (Aluminium),2050 Materials Quantity Surveyor Dataset - 2024,45.4,kg CO₂/m2,24327,0.9978823596407943
4,Glassed panels,Building boards (Multiple functions),Glass,,"Acoustic covering systems (Ss_25_45_02),Gypsum board wall lining systems (Ss_25_25_45_35),General FF&E systems (Ss_40_15_35),Acoustic panel systems (Ss_25_25_05),Gypsum board partition systems (Ss_25_10_30_35),Lining and casing systems (Ss_25_25_45)",,,1,,1,1,piece,A2 panels,SIA VIZULO,https://app.2050-materials.com/product/details_designer/sia-vizulo-a2-panels,9.3,kg CO₂/m2,0.4946808510638298,0.9546105915831349,"Building boards (Multiple functions), Gypsum (per m2)",2050 Materials Research (September 2023),3.244032,kg CO₂/m2,648,0.9663586080838409
5,Aluminium panels,Building boards (Multiple functions),Metal (Other),,"Acoustic covering systems (Ss_25_45_02),Gypsum board wall lining systems (Ss_25_25_45_35),General FF&E systems (Ss_40_15_35),Acoustic panel systems (Ss_25_25_05),Gypsum board partition systems (Ss_25_10_30_35),Lining and casing systems (Ss_25_25_45)",,,1,,1,1,piece,A2 panels,SIA VIZULO,https://app.2050-materials.com/product/details_designer/sia-vizulo-a2-panels,9.3,kg CO₂/m2,0.4946808510638298,0.9569995075825988,"Building boards (Multiple functions), Gypsum (per m2)",2050 Materials Research (September 2023),3.244032,kg CO₂/m2,648,0.96009757065701
6,Internal opaque film,Other (Multiple),Plastic (Other),,,,,1,,1,1,piece,MULTI x IE C optical fiber,Groupe UP,https://app.2050-materials.com/product/details_designer/groupe-up-fibre-optique-multi-x-ie-c,0.146,kg CO₂/m,,0.9363369334334692,"Waste disposal - Plastic, Plastics: average plastic film (Combustion) - Waste Disposal (per tonnes)",UK Government GHG Conversion Factors for Company Reporting (Waste disposal),,kg CO₂/mt,22488,0.9944511025008718
